[
  {
    "id": "ocd-person/e4333f1f-b8d1-5488-95db-48acdf5aa1fe",
    "name": "Brett A. Simas",
    "candidacies": [],
    "verification": {
      "status": "machine-extracted",
      "reviewed_on": "2026-08-25",
      "pipeline": "MA Municipality Research v46 overlay"
    },
    "sources": [
      {
        "url": "https://uptonma.gov/912/Select-Board",
        "retrieved": "2026-08-25"
      }
    ]
  },
  {
    "id": "ocd-person/0a087b87-0b11-585d-8960-021368962004",
    "name": "Maureen Dwinnell",
    "candidacies": [],
    "verification": {
      "status": "machine-extracted",
      "reviewed_on": "2026-08-25",
      "pipeline": "MA Municipality Research v46 overlay"
    },
    "sources": [
      {
        "url": "https://uptonma.gov/912/Select-Board",
        "retrieved": "2026-08-25"
      }
    ]
  },
  {
    "id": "ocd-person/5e407b9f-e2e1-5c6e-a438-c9f67bb71fd7",
    "name": "Laura Hebb",
    "candidacies": [],
    "verification": {
      "status": "machine-extracted",
      "reviewed_on": "2026-08-25",
      "pipeline": "MA Municipality Research v46 overlay"
    },
    "sources": [
      {
        "url": "https://uptonma.gov/912/Select-Board",
        "retrieved": "2026-08-25"
      }
    ]
  },
  {
    "id": "ocd-person/583a574d-068e-5c9e-b489-63f6fb2cdacd",
    "name": "Brittany Besler",
    "candidacies": [],
    "verification": {
      "status": "machine-extracted",
      "reviewed_on": "2026-08-25",
      "pipeline": "MA Municipality Research v46 overlay"
    },
    "sources": [
      {
        "url": "https://www.uptonma.gov/405/Finance-Committee",
        "retrieved": "2026-08-25"
      }
    ]
  }
]
