[
  {
    "id": "ocd-person/c7966e45-5439-5f14-b61e-174ba941b52d",
    "name": "Dario F. Nardi",
    "candidacies": [],
    "verification": {
      "status": "machine-extracted",
      "reviewed_on": "2026-08-25",
      "pipeline": "MA Municipality Research v48 overlay"
    },
    "sources": [
      {
        "url": "https://www.warren-ma.gov/DocumentCenter/View/1956/Annual-Election-Results-May-5-2026-?bidId=",
        "retrieved": "2026-08-25"
      }
    ]
  },
  {
    "id": "ocd-person/c290ccc2-7fff-5396-842e-8608062647e3",
    "name": "Raymond C. Kopacko",
    "candidacies": [],
    "verification": {
      "status": "machine-extracted",
      "reviewed_on": "2026-08-25",
      "pipeline": "MA Municipality Research v48 overlay"
    },
    "sources": [
      {
        "url": "https://www.warren-ma.gov/DocumentCenter/View/1956/Annual-Election-Results-May-5-2026-?bidId=",
        "retrieved": "2026-08-25"
      }
    ]
  },
  {
    "id": "ocd-person/2686621e-a7c6-5da0-a6b6-414d83bca1d5",
    "name": "Anne Norton",
    "candidacies": [],
    "verification": {
      "status": "machine-extracted",
      "reviewed_on": "2026-08-25",
      "pipeline": "MA Municipality Research v48 overlay"
    },
    "sources": [
      {
        "url": "https://www.warren-ma.gov/DocumentCenter/View/1956/Annual-Election-Results-May-5-2026-?bidId=",
        "retrieved": "2026-08-25"
      }
    ]
  },
  {
    "id": "ocd-person/97566bcf-73f9-5c0a-93f8-938f809c9153",
    "name": "John F. Feeney",
    "candidacies": [],
    "verification": {
      "status": "machine-extracted",
      "reviewed_on": "2026-08-25",
      "pipeline": "MA Municipality Research v48 overlay"
    },
    "sources": [
      {
        "url": "https://www.warren-ma.gov/DocumentCenter/View/1956/Annual-Election-Results-May-5-2026-?bidId=",
        "retrieved": "2026-08-25"
      }
    ]
  },
  {
    "id": "ocd-person/9f15e232-1c1e-54b8-961f-4d5f17be1c47",
    "name": "Joan A. Lavigne",
    "candidacies": [],
    "verification": {
      "status": "machine-extracted",
      "reviewed_on": "2026-08-25",
      "pipeline": "MA Municipality Research v48 overlay"
    },
    "sources": [
      {
        "url": "https://www.warren-ma.gov/DocumentCenter/View/1956/Annual-Election-Results-May-5-2026-?bidId=",
        "retrieved": "2026-08-25"
      }
    ]
  },
  {
    "id": "ocd-person/05f82ff8-f7c5-59fa-9a22-105e085fd3a4",
    "name": "Travis A. Baker",
    "candidacies": [],
    "verification": {
      "status": "machine-extracted",
      "reviewed_on": "2026-08-25",
      "pipeline": "MA Municipality Research v48 overlay"
    },
    "sources": [
      {
        "url": "https://www.warren-ma.gov/DocumentCenter/View/1956/Annual-Election-Results-May-5-2026-?bidId=",
        "retrieved": "2026-08-25"
      }
    ]
  },
  {
    "id": "ocd-person/f1452a3a-7dd0-5d7e-b8f7-ea7c096dd7c7",
    "name": "Karyn Wood",
    "candidacies": [],
    "verification": {
      "status": "machine-extracted",
      "reviewed_on": "2026-08-25",
      "pipeline": "MA Municipality Research v48 overlay"
    },
    "sources": [
      {
        "url": "https://www.warren-ma.gov/DocumentCenter/View/1956/Annual-Election-Results-May-5-2026-?bidId=",
        "retrieved": "2026-08-25"
      }
    ]
  },
  {
    "id": "ocd-person/9fbfb4f5-afac-5c31-a18c-1124a8da002f",
    "name": "Cynthia A. Baxter",
    "candidacies": [],
    "verification": {
      "status": "machine-extracted",
      "reviewed_on": "2026-08-25",
      "pipeline": "MA Municipality Research v48 overlay"
    },
    "sources": [
      {
        "url": "https://warren-ma.gov/DocumentCenter/View/1538",
        "retrieved": "2026-08-25"
      }
    ]
  },
  {
    "id": "ocd-person/8ea91176-4e87-553c-a101-0d7bd9216602",
    "name": "Laura J. Stockley",
    "candidacies": [],
    "verification": {
      "status": "machine-extracted",
      "reviewed_on": "2026-08-25",
      "pipeline": "MA Municipality Research v48 overlay"
    },
    "sources": [
      {
        "url": "https://warren-ma.gov/DocumentCenter/View/1538",
        "retrieved": "2026-08-25"
      }
    ]
  },
  {
    "id": "ocd-person/187e786b-e8af-56f5-ad81-c26fd13a93be",
    "name": "Dawn M. Swistak",
    "candidacies": [],
    "verification": {
      "status": "machine-extracted",
      "reviewed_on": "2026-08-25",
      "pipeline": "MA Municipality Research v48 overlay"
    },
    "sources": [
      {
        "url": "https://warren-ma.gov/DocumentCenter/View/1538",
        "retrieved": "2026-08-25"
      }
    ]
  },
  {
    "id": "ocd-person/66d07da1-40db-5338-88ab-360e3c4124cb",
    "name": "Kerry A. Schmidt",
    "candidacies": [],
    "verification": {
      "status": "machine-extracted",
      "reviewed_on": "2026-08-25",
      "pipeline": "MA Municipality Research v48 overlay"
    },
    "sources": [
      {
        "url": "https://warren-ma.gov/DocumentCenter/View/1538",
        "retrieved": "2026-08-25"
      }
    ]
  },
  {
    "id": "ocd-person/580f867f-3d57-5b1f-97d0-9a8ace64d9a5",
    "name": "Jeremy R. Olson",
    "candidacies": [],
    "verification": {
      "status": "machine-extracted",
      "reviewed_on": "2026-08-25",
      "pipeline": "MA Municipality Research v48 overlay"
    },
    "sources": [
      {
        "url": "https://warren-ma.gov/DocumentCenter/View/1538",
        "retrieved": "2026-08-25"
      }
    ]
  }
]
