[
  {
    "id": "ocd-person/431b64a3-bba2-5a5a-a44a-405a4c0c2053",
    "name": "Jeannette A. McCarthy",
    "candidacies": [],
    "verification": {
      "status": "machine-extracted",
      "reviewed_on": "2026-08-25",
      "pipeline": "MA Municipality Research v47 overlay"
    },
    "sources": [
      {
        "url": "https://www.city.waltham.ma.us/1715/About-Mayor-Jeannette-A-McCarthy",
        "retrieved": "2026-08-25"
      }
    ]
  },
  {
    "id": "ocd-person/b8cea900-b313-577b-ba52-07c03529429b",
    "name": "Colleen Bradley-MacArthur",
    "candidacies": [],
    "verification": {
      "status": "machine-extracted",
      "reviewed_on": "2026-08-25",
      "pipeline": "MA Municipality Research v47 overlay"
    },
    "sources": [
      {
        "url": "https://www.city.waltham.ma.us/1341/City-Council",
        "retrieved": "2026-08-25"
      }
    ]
  },
  {
    "id": "ocd-person/85bb8275-7043-5817-aaf0-dffb9ff3dc34",
    "name": "Paul J. Brasco",
    "candidacies": [],
    "verification": {
      "status": "machine-extracted",
      "reviewed_on": "2026-08-25",
      "pipeline": "MA Municipality Research v47 overlay"
    },
    "sources": [
      {
        "url": "https://www.city.waltham.ma.us/1341/City-Council",
        "retrieved": "2026-08-25"
      }
    ]
  },
  {
    "id": "ocd-person/52a4fda0-478d-5502-9534-fc67d6e60c3f",
    "name": "Tim King",
    "candidacies": [],
    "verification": {
      "status": "machine-extracted",
      "reviewed_on": "2026-08-25",
      "pipeline": "MA Municipality Research v47 overlay"
    },
    "sources": [
      {
        "url": "https://www.city.waltham.ma.us/1341/City-Council",
        "retrieved": "2026-08-25"
      }
    ]
  },
  {
    "id": "ocd-person/35a95a7b-a861-513f-ae47-4e986d0c19ff",
    "name": "Randall J. LeBlanc",
    "candidacies": [],
    "verification": {
      "status": "machine-extracted",
      "reviewed_on": "2026-08-25",
      "pipeline": "MA Municipality Research v47 overlay"
    },
    "sources": [
      {
        "url": "https://www.city.waltham.ma.us/1341/City-Council",
        "retrieved": "2026-08-25"
      }
    ]
  },
  {
    "id": "ocd-person/04aa0f69-c353-5f40-a748-5dac6f11c927",
    "name": "Emma Tzioumis",
    "candidacies": [],
    "verification": {
      "status": "machine-extracted",
      "reviewed_on": "2026-08-25",
      "pipeline": "MA Municipality Research v47 overlay"
    },
    "sources": [
      {
        "url": "https://www.city.waltham.ma.us/1341/City-Council",
        "retrieved": "2026-08-25"
      }
    ]
  },
  {
    "id": "ocd-person/8af78d6d-994d-54d4-8f0f-2dc9263ac38f",
    "name": "Carlos A. Vidal",
    "candidacies": [],
    "verification": {
      "status": "machine-extracted",
      "reviewed_on": "2026-08-25",
      "pipeline": "MA Municipality Research v47 overlay"
    },
    "sources": [
      {
        "url": "https://www.city.waltham.ma.us/1341/City-Council",
        "retrieved": "2026-08-25"
      }
    ]
  },
  {
    "id": "ocd-person/246f55ea-6606-5539-aa40-cef40542ab0e",
    "name": "Anthony LaFauci",
    "candidacies": [],
    "verification": {
      "status": "machine-extracted",
      "reviewed_on": "2026-08-25",
      "pipeline": "MA Municipality Research v47 overlay"
    },
    "sources": [
      {
        "url": "https://www.city.waltham.ma.us/1341/City-Council",
        "retrieved": "2026-08-25"
      }
    ]
  },
  {
    "id": "ocd-person/761378f5-f15e-574b-9cba-11724a07f5e8",
    "name": "Caren Dunn",
    "candidacies": [],
    "verification": {
      "status": "machine-extracted",
      "reviewed_on": "2026-08-25",
      "pipeline": "MA Municipality Research v47 overlay"
    },
    "sources": [
      {
        "url": "https://www.city.waltham.ma.us/1341/City-Council",
        "retrieved": "2026-08-25"
      }
    ]
  },
  {
    "id": "ocd-person/f0058413-3711-59e3-825b-b146e26d6e04",
    "name": "Bill Hanley",
    "candidacies": [],
    "verification": {
      "status": "machine-extracted",
      "reviewed_on": "2026-08-25",
      "pipeline": "MA Municipality Research v47 overlay"
    },
    "sources": [
      {
        "url": "https://www.city.waltham.ma.us/1341/City-Council",
        "retrieved": "2026-08-25"
      }
    ]
  },
  {
    "id": "ocd-person/695d0bbf-93d4-58a0-b9d6-e070e8a22687",
    "name": "John J. McLaughlin",
    "candidacies": [],
    "verification": {
      "status": "machine-extracted",
      "reviewed_on": "2026-08-25",
      "pipeline": "MA Municipality Research v47 overlay"
    },
    "sources": [
      {
        "url": "https://www.city.waltham.ma.us/1341/City-Council",
        "retrieved": "2026-08-25"
      }
    ]
  },
  {
    "id": "ocd-person/b3d267c2-d0e1-5376-8a1b-82f2b8b7caf3",
    "name": "Joseph P. LaCava",
    "candidacies": [],
    "verification": {
      "status": "machine-extracted",
      "reviewed_on": "2026-08-25",
      "pipeline": "MA Municipality Research v47 overlay"
    },
    "sources": [
      {
        "url": "https://www.city.waltham.ma.us/1341/City-Council",
        "retrieved": "2026-08-25"
      }
    ]
  },
  {
    "id": "ocd-person/630b963d-b88d-54db-944f-88971730b6e6",
    "name": "Sean Durkee",
    "candidacies": [],
    "verification": {
      "status": "machine-extracted",
      "reviewed_on": "2026-08-25",
      "pipeline": "MA Municipality Research v47 overlay"
    },
    "sources": [
      {
        "url": "https://www.city.waltham.ma.us/1341/City-Council",
        "retrieved": "2026-08-25"
      }
    ]
  },
  {
    "id": "ocd-person/7d29d7aa-109a-5446-9a6e-c7a7d8edff89",
    "name": "Paul S. Katz",
    "candidacies": [],
    "verification": {
      "status": "machine-extracted",
      "reviewed_on": "2026-08-25",
      "pipeline": "MA Municipality Research v47 overlay"
    },
    "sources": [
      {
        "url": "https://www.city.waltham.ma.us/1341/City-Council",
        "retrieved": "2026-08-25"
      }
    ]
  },
  {
    "id": "ocd-person/ef5842ef-0c96-5bc1-af3b-748db18d2685",
    "name": "Cathyann Harris",
    "candidacies": [],
    "verification": {
      "status": "machine-extracted",
      "reviewed_on": "2026-08-25",
      "pipeline": "MA Municipality Research v47 overlay"
    },
    "sources": [
      {
        "url": "https://www.city.waltham.ma.us/1341/City-Council",
        "retrieved": "2026-08-25"
      }
    ]
  },
  {
    "id": "ocd-person/467c793f-12d3-5f9a-834d-53a561935f7a",
    "name": "Robert G. Logan",
    "candidacies": [],
    "verification": {
      "status": "machine-extracted",
      "reviewed_on": "2026-08-25",
      "pipeline": "MA Municipality Research v47 overlay"
    },
    "sources": [
      {
        "url": "https://www.city.waltham.ma.us/1341/City-Council",
        "retrieved": "2026-08-25"
      }
    ]
  }
]
