[
  {
    "id": "ocd-person/991cfc3b-6f4c-590a-a105-5ae9ff3a4a25",
    "name": "Kirk Moschetti",
    "candidacies": [],
    "verification": {
      "status": "machine-extracted",
      "reviewed_on": "2026-08-25",
      "pipeline": "MA Municipality Research v45 overlay"
    },
    "sources": [
      {
        "url": "https://www.templetonma.gov/Directory.aspx?did=34",
        "retrieved": "2026-08-25"
      }
    ]
  },
  {
    "id": "ocd-person/6a97a0f8-a92b-54a5-b0b9-66b7145fc4ee",
    "name": "Charles Carroll",
    "candidacies": [],
    "verification": {
      "status": "machine-extracted",
      "reviewed_on": "2026-08-25",
      "pipeline": "MA Municipality Research v45 overlay"
    },
    "sources": [
      {
        "url": "https://www.templetonma.gov/Directory.aspx?did=34",
        "retrieved": "2026-08-25"
      }
    ]
  },
  {
    "id": "ocd-person/15b45cb7-7a7a-527c-9bf6-2747ac50d249",
    "name": "Dennis Rich",
    "candidacies": [],
    "verification": {
      "status": "machine-extracted",
      "reviewed_on": "2026-08-25",
      "pipeline": "MA Municipality Research v45 overlay"
    },
    "sources": [
      {
        "url": "https://www.templetonma.gov/Directory.aspx?did=34",
        "retrieved": "2026-08-25"
      }
    ]
  },
  {
    "id": "ocd-person/674048b4-7066-593a-bc28-3257a9a3bc99",
    "name": "Michael Caruso",
    "candidacies": [],
    "verification": {
      "status": "machine-extracted",
      "reviewed_on": "2026-08-25",
      "pipeline": "MA Municipality Research v45 overlay"
    },
    "sources": [
      {
        "url": "https://www.templetonma.gov/Directory.aspx?did=34",
        "retrieved": "2026-08-25"
      }
    ]
  },
  {
    "id": "ocd-person/4c716dd9-73e2-5d96-b24e-f79f02196c28",
    "name": "Adam Little",
    "candidacies": [],
    "verification": {
      "status": "machine-extracted",
      "reviewed_on": "2026-08-25",
      "pipeline": "MA Municipality Research v45 overlay"
    },
    "sources": [
      {
        "url": "https://www.templetonma.gov/Directory.aspx?did=34",
        "retrieved": "2026-08-25"
      }
    ]
  },
  {
    "id": "ocd-person/c6c557f1-ac92-5d63-ad59-87a797a940cd",
    "name": "John Henshaw",
    "candidacies": [],
    "verification": {
      "status": "machine-extracted",
      "reviewed_on": "2026-08-25",
      "pipeline": "MA Municipality Research v45 overlay"
    },
    "sources": [
      {
        "url": "https://www.templetonma.gov/1327/Community-Preservation-Committee",
        "retrieved": "2026-08-25"
      }
    ]
  },
  {
    "id": "ocd-person/e0bbe988-8445-5b63-a1f6-d826cf4215d8",
    "name": "Carrie Novak",
    "candidacies": [],
    "verification": {
      "status": "machine-extracted",
      "reviewed_on": "2026-08-25",
      "pipeline": "MA Municipality Research v45 overlay"
    },
    "sources": [
      {
        "url": "https://www.templetonma.gov/1327/Community-Preservation-Committee",
        "retrieved": "2026-08-25"
      }
    ]
  },
  {
    "id": "ocd-person/e310aab3-e938-5915-a16d-434b6a957cf3",
    "name": "Jo-Anne Burdin",
    "candidacies": [],
    "verification": {
      "status": "machine-extracted",
      "reviewed_on": "2026-08-25",
      "pipeline": "MA Municipality Research v45 overlay"
    },
    "sources": [
      {
        "url": "https://www.templetonma.gov/1327/Community-Preservation-Committee",
        "retrieved": "2026-08-25"
      }
    ]
  }
]
